,tipo,titulo,link,autor,data,descricao
0,Blog Post,Why and How I Became an Agile Coach,https://www.scrum.org/resources/blog/why-and-how-i-became-agile-coach,,18/12/2018,"As an agile coach and trainer, I have had the opportunity to reach thousands of students that are just beginning their journey into the Scrum and agile world."
1,Video,Managing for Happiness,https://www.agilealliance.org/resources/videos/managing-for-happiness/,Jurgen Appelo,,Video of Agile2016 opening keynote by Jurgen Appelo. Learn concretely how to be servant leaders and system thinkers.
